{
  "$schema": "../schema/windows-runtime-acquisition-lock.schema.json",
  "schemaId": "local-whisper-windows-runtime-acquisition-lock-v1",
  "lockId": "microsoft-vc-runtime-14.51.36247.0-x64-v1",
  "target": { "os": "windows", "architecture": "x64" },
  "installer": {
    "url": "https://aka.ms/vs/18/release/14.51.36247/VC_redist.x64.exe",
    "sizeBytes": 18731856,
    "sha256": "843068991daaa1f73ad9f6239bce4d0f6a07a51f18c37ea2a867e9beca71295c",
    "fileVersion": "14.51.36247.0",
    "productVersion": "14.51.36247.0",
    "originalFilename": "VC_redist.x64.exe",
    "targetArchitecture": "x64",
    "bootstrapMachine": "x86",
    "authenticodeStatus": "Valid",
    "publisherSubject": "CN=Microsoft Corporation"
  },
  "installedRuntime": {
    "registryHive": "HKEY_LOCAL_MACHINE",
    "registryView": "Registry64",
    "registryKey": "SOFTWARE\\Microsoft\\VisualStudio\\14.0\\VC\\Runtimes\\x64",
    "installedValue": "Installed",
    "versionValue": "Version",
    "version": "v14.51.36247.00"
  },
  "materialization": {
    "source": "native-system32",
    "relativeDestination": "vc-runtime-14.51.36247.0-x64",
    "manifestName": "materialization-manifest.json",
    "dllAllowlist": [
      {
        "name": "concrt140.dll",
        "sizeBytes": 374200,
        "sha256": "54716f0738af891f283d213b5c8d11b25896bb8ee3097d301eae718560cf974e",
        "fileVersion": "14.51.36247.0",
        "productVersion": "14.51.36247.0"
      },
      {
        "name": "msvcp140.dll",
        "sizeBytes": 643512,
        "sha256": "7c26614e1d733892c2deac7e245ce115504b1d80592dd0a01b08e3e5a55f89ca",
        "fileVersion": "14.51.36247.0",
        "productVersion": "14.51.36247.0"
      },
      {
        "name": "msvcp140_1.dll",
        "sizeBytes": 35768,
        "sha256": "206c931bf90fdad8816de3b5e2ef80b2bcaa9406c89ecc05fe6fddffe251e982",
        "fileVersion": "14.51.36247.0",
        "productVersion": "14.51.36247.0"
      },
      {
        "name": "msvcp140_2.dll",
        "sizeBytes": 274872,
        "sha256": "d50d7883f20d1dc6191768d3746f52dd9cac89c346ffaed5be1f110c2f34a838",
        "fileVersion": "14.51.36247.0",
        "productVersion": "14.51.36247.0"
      },
      {
        "name": "msvcp140_atomic_wait.dll",
        "sizeBytes": 57792,
        "sha256": "3d0cbfaa1bf3eecf5a3f4491d2960ee803cb994f30292c6adc4a07c498f60e2b",
        "fileVersion": "14.51.36247.0",
        "productVersion": "14.51.36247.0"
      },
      {
        "name": "msvcp140_codecvt_ids.dll",
        "sizeBytes": 31160,
        "sha256": "8a65c7596ef2e6938731f5a1058e7e40145b6d97967cc649231a076b9a608d78",
        "fileVersion": "14.51.36247.0",
        "productVersion": "14.51.36247.0"
      },
      {
        "name": "vcruntime140.dll",
        "sizeBytes": 178616,
        "sha256": "d1f4225df2cd877dbf130d5668a021dce3f94118455ff5ec952061c30afc9ce7",
        "fileVersion": "14.51.36247.0",
        "productVersion": "14.51.36247.0"
      },
      {
        "name": "vcruntime140_1.dll",
        "sizeBytes": 50112,
        "sha256": "a7146c08f89fe5b04541ab507cdb59ff7b44534d4ba3c668a426c6450a03434e",
        "fileVersion": "14.51.36247.0",
        "productVersion": "14.51.36247.0"
      },
      {
        "name": "vcruntime140_threads.dll",
        "sizeBytes": 38840,
        "sha256": "40f39e8cee5f5a531b4010e18b807e8fe265b908dc58f959ecb7ebc6ea6cb11a",
        "fileVersion": "14.51.36247.0",
        "productVersion": "14.51.36247.0"
      }
    ]
  },
  "license": {
    "url": "https://visualstudio.microsoft.com/license-terms/vs2026-ga-visualcpp-v14-redist-runtime/",
    "pathKind": "toolchainRootRelative",
    "path": "licenses/visual-cpp-v14-runtime.html",
    "sizeBytes": 243617,
    "sha256": "f5b1ee76a201ddbd56dbea08ccc24d4cbaf597897df27f6aa76b2c7952aa4299"
  }
}
